[
  {
    "sid": "segment_01",
    "start_time": 41,
    "end_time": 81,
    "title": "프로젝트 설명 시작",
    "summary": [
      "Record Moment Picker 발표가 시작됨",
      "프로젝트의 데이터 구조가 생각보다 복잡하다는 점을 언급함"
    ],
    "texts": [
      {
        "t_id": "001",
        "time": 41,
        "text": "안녕하세요, RecordMomentPicker 발표를 시작하겠습니다."
      },
      {
        "t_id": "002",
        "time": 57,
        "text": "이 프로젝트는 생각보다 데이터 구조가 복잡합니다."
      }
    ],
    "important": [
      {
        "time": 57,
        "title": "복잡한 데이터 구조"
      }
    ],
    "clues": [
      {
        "summary_index": 0,
        "clue": ["001"]
      },
      {
        "summary_index": 1,
        "clue": ["002"]
      }
    ]
  },
  {
    "sid": "segment_02",
    "start_time": 83,
    "end_time": 145,
    "title": "목차 및 개발 배경 설명",
    "summary": [
      "발표의 목차와 진행 방향을 설명함",
      "긴 녹음에서 중요한 부분을 찾기 어렵다는 문제의식에서 프로젝트가 시작됨",
      "중요한 순간을 자동으로 찾아주는 서비스를 만들고자 함"
    ],
    "texts": [
      {
        "t_id": "003",
        "time": 83,
        "text": "이번 발표의 목차는 먼저 프로젝트 개요를 설명하고, 다음으로 데이터 흐름을 설명하는 순서입니다."
      },
      {
        "t_id": "004",
        "time": 107,
        "text": "이 프로젝트를 떠올리게 된 계기는 긴 녹음에서 중요한 부분을 다시 찾기 어려웠기 때문입니다."
      },
      {
        "t_id": "005",
        "time": 135,
        "text": "그래서 중요한 순간을 자동으로 찾아주는 방향으로 발표를 진행하겠습니다."
      }
    ],
    "important": [
      {
        "time": 107,
        "title": "개발 배경"
      },
      {
        "time": 135,
        "title": "서비스 방향성"
      }
    ],
    "clues": [
      {
        "summary_index": 0,
        "clue": ["003", "005"]
      },
      {
        "summary_index": 1,
        "clue": ["004"]
      },
      {
        "summary_index": 2,
        "clue": ["005"]
      }
    ]
  }
]