[
  {
    "sid": "segment_01",
    "start_time": 0,
    "end_time": 210,
    "title": "회의 목표와 홍보 영상 방향",
    "summary": [
      "홍보 영상의 목적은 신입 부원 모집이며, 정보 전달보다 동아리 분위기를 보여주는 방향으로 정리됨",
      "영상은 개강 첫 주 전에 완성해야 하므로 촬영과 편집 일정을 압축해서 진행해야 함",
      "오늘 회의에서는 콘셉트, 장소, 역할, 예산, 리스크를 함께 결정하기로 함"
    ],
    "texts": [
      {
        "t_id": "001",
        "time": 0,
        "text": "오늘 회의는 홍보 영상 제작 방향과 일정, 역할 분담까지 한 번에 정리하는 걸 목표로 하겠습니다."
      },
      {
        "t_id": "002",
        "time": 37,
        "text": "이번 영상은 신입 부원 모집용이라서 동아리 분위기가 잘 보여야 하고, 단순한 설명 영상처럼 보이면 안 됩니다."
      },
      {
        "t_id": "003",
        "time": 88,
        "text": "개강 첫 주 월요일 전에 학생회관 모니터에 틀 수 있어야 하니까 최종본은 그 전 주 금요일까지 필요합니다."
      },
      {
        "t_id": "004",
        "time": 141,
        "text": "오늘 안에 콘셉트, 촬영 장소, 역할 분담, 예산 문제까지 큰 결정을 내려야 뒤 일정이 밀리지 않습니다."
      },
      {
        "t_id": "005",
        "time": 183,
        "text": "세부 대본은 나중에 손보더라도 오늘은 전체 흐름과 책임자를 확정하는 것이 우선입니다."
      }
    ],
    "important": [
      {
        "time": 37,
        "title": "홍보 영상 목적 확인"
      },
      {
        "time": 88,
        "title": "최종본 마감 확인"
      }
    ],
    "clues": [
      {
        "summary_index": 0,
        "clue": ["002", "007", "022"]
      },
      {
        "summary_index": 1,
        "clue": ["003", "018", "026"]
      },
      {
        "summary_index": 2,
        "clue": ["001", "004", "014", "021"]
      }
    ]
  },
  {
    "sid": "segment_02",
    "start_time": 211,
    "end_time": 482,
    "title": "콘셉트와 구성 방식 결정",
    "summary": [
      "영상은 인터뷰 중심보다 활동 하루를 따라가는 브이로그 형식으로 구성하기로 함",
      "초반 10초에는 시선을 끌 수 있는 장면을 배치하고, 주요 정보는 자막으로 보완하기로 함",
      "부원들의 짧은 한마디를 후반부에 넣어 실제 경험과 진정성을 보여주기로 함"
    ],
    "texts": [
      {
        "t_id": "006",
        "time": 211,
        "text": "인터뷰만 이어 붙이면 너무 평범하니까 하루 활동을 따라가는 브이로그 형식이 더 좋을 것 같습니다."
      },
      {
        "t_id": "007",
        "time": 253,
        "text": "신입생들이 보고 들어오고 싶다는 느낌을 받으려면 활동 분위기가 자연스럽게 보여야 합니다."
      },
      {
        "t_id": "008",
        "time": 296,
        "text": "처음 10초에서 재미가 없으면 바로 넘길 수 있어서, 시작은 다 같이 작업하는 장면으로 강하게 열면 좋겠습니다."
      },
      {
        "t_id": "009",
        "time": 342,
        "text": "정기 모임 시간이나 지원 방법 같은 정보는 말로 길게 설명하지 말고 자막으로 짧게 넣읍시다."
      },
      {
        "t_id": "010",
        "time": 389,
        "text": "마지막에는 부원들이 한 문장씩 왜 이 동아리에 들어왔는지 말하면 진정성이 살아날 것 같습니다."
      },
      {
        "t_id": "011",
        "time": 438,
        "text": "전체 톤은 너무 진지하지 않게 가되, 필요한 정보는 빠지지 않게 구성해야 합니다."
      }
    ],
    "important": [
      {
        "time": 211,
        "title": "브이로그 형식 결정"
      },
      {
        "time": 296,
        "title": "초반 10초 구성"
      },
      {
        "time": 389,
        "title": "부원 한마디 삽입"
      }
    ],
    "clues": [
      {
        "summary_index": 0,
        "clue": ["006", "007", "023"]
      },
      {
        "summary_index": 1,
        "clue": ["008", "009", "020"]
      },
      {
        "summary_index": 2,
        "clue": ["010", "022"]
      }
    ]
  },
  {
    "sid": "segment_03",
    "start_time": 483,
    "end_time": 764,
    "title": "촬영 장소와 리스크 관리",
    "summary": [
      "주요 촬영 장소는 학생회관 앞, 동아리방, 야외 계단, 세미나실로 정리됨",
      "동아리방은 분위기가 잘 보이지만 공간과 소음 문제가 있어 촬영 시간 조율이 필요함",
      "우천 시 야외 촬영을 실내 장면으로 대체하는 플랜이 필요함"
    ],
    "texts": [
      {
        "t_id": "012",
        "time": 483,
        "text": "장소는 학생회관 앞, 동아리방 작업 장면, 야외 계단 컷, 세미나실 발표 장면 정도로 잡으면 좋겠습니다."
      },
      {
        "t_id": "013",
        "time": 531,
        "text": "동아리방은 분위기는 잘 나오는데 공간이 좁아서 카메라랑 조명을 놓기가 애매할 수 있습니다."
      },
      {
        "t_id": "014",
        "time": 574,
        "text": "옆방에서 밴드 연습을 하면 소리가 많이 들어갈 수 있어서 촬영 시간을 따로 확인해야 합니다."
      },
      {
        "t_id": "015",
        "time": 621,
        "text": "세미나실 예약이 안 되면 빈 강의실을 대안으로 찾아보겠습니다."
      },
      {
        "t_id": "016",
        "time": 666,
        "text": "토요일에 비가 오면 학생회관 앞이랑 야외 계단 장면은 거의 못 찍는다고 봐야 합니다."
      },
      {
        "t_id": "017",
        "time": 711,
        "text": "그 경우에는 게시판 앞 소개 장면이나 실내에서 걷는 장면으로 대체하는 플랜을 준비합시다."
      }
    ],
    "important": [
      {
        "time": 483,
        "title": "촬영 장소 후보 정리"
      },
      {
        "time": 574,
        "title": "소음 리스크 확인"
      },
      {
        "time": 666,
        "title": "우천 대체 플랜 필요"
      }
    ],
    "clues": [
      {
        "summary_index": 0,
        "clue": ["012", "024"]
      },
      {
        "summary_index": 1,
        "clue": ["013", "014", "025"]
      },
      {
        "summary_index": 2,
        "clue": ["016", "017", "026"]
      }
    ]
  },
  {
    "sid": "segment_04",
    "start_time": 765,
    "end_time": 1046,
    "title": "역할 분담과 편집 일정",
    "summary": [
      "민수는 장비 대여와 촬영 당일 세팅을 맡기로 함",
      "지연은 대본과 자막 문구를 정리하고 인터뷰 질문을 준비하기로 함",
      "은규는 촬영본 정리와 1차 편집을 맡고 수요일 밤까지 러프컷을 공유하기로 함"
    ],
    "texts": [
      {
        "t_id": "018",
        "time": 765,
        "text": "장비는 민수가 대여 가능 여부를 확인하고 촬영 당일 삼각대와 마이크 세팅까지 맡아주면 좋겠습니다."
      },
      {
        "t_id": "019",
        "time": 812,
        "text": "대본은 지연이가 오늘 나온 콘셉트를 바탕으로 정리하고 자막에 들어갈 핵심 문구도 같이 잡아주세요."
      },
      {
        "t_id": "020",
        "time": 861,
        "text": "부원 인터뷰 질문은 길지 않게 세 개 정도만 준비하고 답변은 한 문장으로 받을 수 있게 합시다."
      },
      {
        "t_id": "021",
        "time": 905,
        "text": "촬영본 정리랑 1차 편집은 제가 맡겠습니다. 수요일 밤까지 러프컷을 단톡방에 올릴게요."
      },
      {
        "t_id": "022",
        "time": 957,
        "text": "부원 한마디는 편집 후반부에 넣고, 전체 분위기와 잘 맞는 답변 위주로 고르겠습니다."
      },
      {
        "t_id": "023",
        "time": 1001,
        "text": "브이로그 흐름이 깨지지 않도록 인터뷰 장면은 너무 길게 넣지 않는 게 좋겠습니다."
      }
    ],
    "important": [
      {
        "time": 765,
        "title": "민수 장비 담당"
      },
      {
        "time": 812,
        "title": "지연 대본 담당"
      },
      {
        "time": 905,
        "title": "은규 편집 담당"
      }
    ],
    "clues": [
      {
        "summary_index": 0,
        "clue": ["018", "028"]
      },
      {
        "summary_index": 1,
        "clue": ["019", "020", "009"]
      },
      {
        "summary_index": 2,
        "clue": ["021", "003"]
      }
    ]
  },
  {
    "sid": "segment_05",
    "start_time": 1047,
    "end_time": 1328,
    "title": "예산과 장비 대여",
    "summary": [
      "마이크와 조명은 학교 장비실에서 빌리는 것을 우선으로 하되 실패하면 개인 장비를 섞어 쓰기로 함",
      "추가 예산은 소품과 간식에 제한적으로 쓰고 회비 추가 징수는 최소화하기로 함",
      "배경 음악과 외부인 얼굴 노출은 저작권 및 초상권 문제를 고려해 편집 단계에서 다시 확인하기로 함"
    ],
    "texts": [
      {
        "t_id": "024",
        "time": 1047,
        "text": "마이크랑 조명은 학교 장비실에서 먼저 빌려보고, 예약이 안 되면 개인 장비를 섞어서 쓰는 걸로 합시다."
      },
      {
        "t_id": "025",
        "time": 1094,
        "text": "조명을 동아리방에 놓을 공간이 충분하지 않을 수도 있으니 세팅 동선을 촬영 전에 확인해야 합니다."
      },
      {
        "t_id": "026",
        "time": 1142,
        "text": "비가 오면 소품을 들고 이동하는 것도 번거로우니까 실내 대체 장면 기준으로 필요한 물품을 다시 정리합시다."
      },
      {
        "t_id": "027",
        "time": 1191,
        "text": "예산은 간식하고 작은 소품 정도에 쓰고 회비를 추가로 걷는 건 최대한 피했으면 합니다."
      },
      {
        "t_id": "028",
        "time": 1238,
        "text": "장비 대여가 안 되면 민수 개인 마이크와 제 삼각대를 같이 쓰는 대안도 있습니다."
      },
      {
        "t_id": "029",
        "time": 1285,
        "text": "배경 음악은 무료 음원만 쓰고, 지나가는 사람 얼굴이 잘 나오면 모자이크 처리해야 합니다."
      }
    ],
    "important": [
      {
        "time": 1047,
        "title": "학교 장비 우선 대여"
      },
      {
        "time": 1191,
        "title": "회비 추가 징수 최소화"
      },
      {
        "time": 1285,
        "title": "저작권 및 초상권 확인"
      }
    ],
    "clues": [
      {
        "summary_index": 0,
        "clue": ["024", "028", "018"]
      },
      {
        "summary_index": 1,
        "clue": ["027", "026"]
      },
      {
        "summary_index": 2,
        "clue": ["029", "011"]
      }
    ]
  }
]
